{
  "$schema": "https://json-schema.org/draft/2020-12/schema",
  "$id": "exercise.schema.json",
  "title": "Exercise",
  "description": "A single practice exercise (flashcard) for the multiple choice app.",
  "type": "object",
  "required": [
    "inputMode",
    "mobileSolvable",
    "correct",
    "learningLevel",
    "difficulty",
    "categories",
    "specializations"
  ],
  "properties": {
    "inputMode": {
      "type": "string",
      "enum": ["SINGLE_CHOICE", "MULTIPLE_CHOICE", "TEXT", "NUMBER", "MATCH"],
      "description": "Determines the input UI and validation logic."
    },
    "mobileSolvable": {
      "type": "boolean",
      "description": "Whether the exercise can be completed comfortably on a small screen without external tools such as a calculator."
    },
    "learningLevel": {
      "type": "integer",
      "minimum": 1,
      "maximum": 10,
      "description": "Learner-facing curriculum stage used as an inclusive maximum filter. This is separate from card difficulty and learner mastery."
    },
    "difficulty": {
      "type": "integer",
      "minimum": 1,
      "maximum": 5,
      "description": "Estimated intrinsic card difficulty used for XP weighting. May later be calibrated from answer data."
    },
    "instruction": {
      "type": "string",
      "description": "Question text shown above the answer area. Supports Markdown."
    },
    "images": {
      "type": "array",
      "items": { "type": "string" },
      "description": "Filenames of images in /data/img/ to display alongside the instruction."
    },
    "answerOptions": {
      "type": "array",
      "uniqueItems": true,
      "items": {
        "type": "string",
        "minLength": 1,
        "pattern": "\\S"
      },
      "description": "List of answer options for SINGLE_CHOICE, MULTIPLE_CHOICE, and MATCH modes. Supports Markdown."
    },
    "submitButton": {
      "type": "boolean",
      "default": true,
      "description": "Whether SINGLE_CHOICE requires an explicit submit action. Defaults to true."
    },
    "correct": {
      "type": "array",
      "minItems": 1,
      "uniqueItems": true,
      "description": "Non-empty array of correct answers. Item type and cardinality depend on inputMode."
    },
    "caseSensitive": {
      "type": "boolean",
      "default": false,
      "description": "TEXT mode only. Whether the comparison is case-sensitive."
    },
    "maximumStringDistance": {
      "type": "integer",
      "minimum": 0,
      "description": "TEXT mode only. Maximum Levenshtein distance allowed per word for literal answers. Defaults to 1."
    },
    "explainInstruction": {
      "type": "string",
      "description": "Explanation text shown after answering. Explains the correct answer in context. Supports Markdown."
    },
    "matchOptions": {
      "type": "array",
      "uniqueItems": true,
      "items": {
        "type": "string",
        "minLength": 1,
        "pattern": "\\S"
      },
      "description": "Plain-text right-side labels for MATCH mode. Each entry pairs with an answerOptions item through the indices in correct."
    },
    "explainAnswerOptions": {
      "type": "array",
      "items": { "type": "string" },
      "description": "Per-option explanations, one per entry in answerOptions. Shown after answering to explain why each option is correct or incorrect. Supports Markdown."
    },
    "distractorTypes": {
      "type": "object",
      "additionalProperties": { "type": "string" },
      "description": "Optional mapping of answer option index (as string integer key '0', '1', ...) to distractor strategy classification (e.g. 'similarTerm', 'negation', 'absoluteStatement'). Extensible open string taxonomy."
    },
    "distractorAnalysis": {
      "type": "object",
      "additionalProperties": { "type": "string" },
      "description": "Optional mapping of answer option index (as string integer key '0', '1', ...) to author explanation of why this option is a plausible distractor and how it tricks learners."
    },
    "adminComment": {
      "type": "string",
      "description": "Internal note for exercise authors. Not displayed to users."
    },
    "categories": {
      "type": "array",
      "minItems": 1,
      "uniqueItems": true,
      "items": {
        "type": "string",
        "minLength": 1,
        "pattern": "\\S"
      },
      "description": "One or more categories for filtering and statistics. Every exercise must have at least one category."
    },
    "specializations": {
      "type": "array",
      "minItems": 1,
      "uniqueItems": true,
      "items": {
        "type": "string",
        "enum": ["FIAN", "FISI", "FIDP", "FIDV"]
      },
      "description": "One or more IT specializations for which the exercise is relevant. Every applicable specialization must be listed explicitly. Multiple entries allow overlapping scope, such as FISI and FIDV."
    },
    "adminTags": {
      "type": "array",
      "uniqueItems": true,
      "items": {
        "type": "string",
        "minLength": 1,
        "pattern": "\\S"
      },
      "description": "Optional workflow markers for authors and reviewers, such as draft, needs-review, or error-reported. Not used as learner-facing categories."
    }
  },
  "allOf": [
    {
      "if": {
        "properties": { "inputMode": { "const": "SINGLE_CHOICE" } }
      },
      "then": {
        "required": ["answerOptions"],
        "properties": {
          "answerOptions": {
            "type": "array",
            "minItems": 1
          },
          "correct": {
            "type": "array",
            "minItems": 1,
            "maxItems": 1,
            "items": {
              "type": "integer",
              "minimum": 0
            }
          }
        }
      }
    },
    {
      "if": {
        "properties": { "inputMode": { "const": "MULTIPLE_CHOICE" } }
      },
      "then": {
        "required": ["answerOptions"],
        "properties": {
          "answerOptions": {
            "type": "array",
            "minItems": 1
          },
          "correct": {
            "type": "array",
            "minItems": 1,
            "uniqueItems": true,
            "items": {
              "type": "integer",
              "minimum": 0
            }
          }
        }
      }
    },
    {
      "if": {
        "properties": { "inputMode": { "const": "TEXT" } }
      },
      "then": {
        "properties": {
          "correct": {
            "type": "array",
            "minItems": 1,
            "uniqueItems": true,
            "items": {
              "type": "string",
              "minLength": 1,
              "pattern": "\\S"
            }
          }
        }
      }
    },
    {
      "if": {
        "properties": { "inputMode": { "const": "NUMBER" } }
      },
      "then": {
        "properties": {
          "correct": {
            "type": "array",
            "minItems": 1,
            "maxItems": 1,
            "items": {
              "type": "number"
            }
          }
        }
      }
    },
    {
      "if": {
        "properties": { "inputMode": { "const": "MATCH" } }
      },
      "then": {
        "required": ["answerOptions", "matchOptions"],
        "properties": {
          "answerOptions": {
            "type": "array",
            "minItems": 1
          },
          "matchOptions": {
            "type": "array",
            "minItems": 1
          },
          "correct": {
            "type": "array",
            "minItems": 1,
            "uniqueItems": true,
            "items": {
              "type": "integer",
              "minimum": 0
            },
            "description": "Permutation array: correct[i] is the index into matchOptions that pairs with answerOptions[i]."
          }
        }
      }
    }
  ]
}
