{
    "inputMode": "SINGLE_CHOICE",
    "mobileSolvable": true,
    "learningLevel": 2,
    "difficulty": 1,
    "categories": [
        "AP1",
        "Betriebssysteme und Netzwerke"
    ],
    "instruction": "Welche Hauptaufgabe hat DNS?",
    "answerOptions": [
        "Namen wie `example.org` in zugehörige Ressourcen wie IP-Adressen auflösen",
        "Dateien auf der Festplatte verschlüsseln",
        "SQL-Transaktionen sperren",
        "Quellcode kompilieren"
    ],
    "correct": [
        0
    ],
    "explainInstruction": "Das Domain Name System ist ein verteiltes Namenssystem und liefert zu Namen verschiedene Ressourceneinträge, darunter A- und AAAA-Adressen.",
    "specializations": [
        "FIAN",
        "FISI",
        "FIDP",
        "FIDV"
    ],
    "distractorTypes": {
        "1": "conceptContradiction",
        "2": "conceptContradiction",
        "3": "conceptContradiction"
    },
    "distractorAnalysis": {
        "1": "Widerspruch zur geforderten fachlichen Kernaussage der Aufgabenstellung.",
        "2": "Widerspruch zur geforderten fachlichen Kernaussage der Aufgabenstellung.",
        "3": "Widerspruch zur geforderten fachlichen Kernaussage der Aufgabenstellung."
    }
}
