{
    "inputMode": "SINGLE_CHOICE",
    "mobileSolvable": true,
    "learningLevel": 6,
    "difficulty": 1,
    "categories": [
        "AP2",
        "Web, APIs und Sicherheit"
    ],
    "instruction": "Wie sollten Passwörter serverseitig gespeichert werden?",
    "answerOptions": [
        "Im Klartext für schnelle Vergleiche",
        "Mit einer schnellen allgemeinen Hashfunktion ohne Salt",
        "Mit einem individuellen Salt und einer langsamen Passwort-Hashfunktion wie Argon2id oder bcrypt",
        "Base64-kodiert"
    ],
    "correct": [
        2
    ],
    "explainInstruction": "Passwort-Hashfunktionen sind absichtlich aufwendig. Ein individuelles Salt verhindert, dass gleiche Passwörter denselben gespeicherten Wert besitzen.",
    "specializations": [
        "FIAN"
    ],
    "distractorTypes": {
        "0": "conceptContradiction",
        "1": "negationOversight",
        "3": "conceptContradiction"
    },
    "distractorAnalysis": {
        "0": "Widerspruch zur geforderten fachlichen Kernaussage der Aufgabenstellung.",
        "1": "Falle durch implizite oder explizite Verneinungselemente im Antworttext.",
        "3": "Widerspruch zur geforderten fachlichen Kernaussage der Aufgabenstellung."
    }
}
