{
    "inputMode": "MULTIPLE_CHOICE",
    "instruction": "Welche Beschreibungen von Verhaltensmustern (behavioral patterns) sind korrekt zugeordnet?",
    "answerOptions": [
        "Zuständigkeitskette (Chain of Responsibility) – leitet eine Anfrage durch mögliche Bearbeiter, bis einer sie übernimmt.",
        "Befehl (Command) – kapselt eine Anforderung als Objekt und ermöglicht etwa Warteschlangen oder Rückgängig-Aktionen.",
        "Iterator (Iterator) – durchläuft Elemente, ohne die interne Repräsentation der Sammlung offenzulegen.",
        "Vermittler (Mediator) – zentralisiert die Zusammenarbeit mehrerer Objekte in einem Vermittlungsobjekt.",
        "Memento (Memento) – erfasst einen wiederherstellbaren Zustand, ohne die Kapselung zu verletzen.",
        "Beobachter (Observer) – wählt aus einer Familie austauschbarer Algorithmen.",
        "Zustand (State) – benachrichtigt zwingend alle registrierten Abonnenten."
    ],
    "correct": [
        0,
        1,
        2,
        3,
        4
    ],
    "explainInstruction": "Die letzten beiden Aussagen vertauschen Beobachter (Observer) mit Strategie (Strategy) sowie Zustand (State) mit einer Benachrichtigungsaufgabe.",
    "mobileSolvable": true,
    "learningLevel": 7,
    "difficulty": 3,
    "categories": [
        "AP2",
        "Softwarearchitektur und Entwurfsmuster",
        "GoF-Klassifikation"
    ],
    "specializations": [
        "FIAN"
    ],
    "distractorTypes": {
        "5": "similarTermConfusion",
        "6": "absoluteStatementTrap"
    },
    "distractorAnalysis": {
        "5": "Verwechslung mit einem inhaltlich verwandten Fachbegriff oder Schema.",
        "6": "Fallstrick durch unzulässige Absolutformulierung (z.B. immer/nie/generell)."
    }
}
