{
    "inputMode": "MULTIPLE_CHOICE",
    "mobileSolvable": true,
    "learningLevel": 3,
    "difficulty": 2,
    "categories": [
        "AP1",
        "Datenschutz"
    ],
    "specializations": [
        "FIAN",
        "FISI",
        "FIDP",
        "FIDV"
    ],
    "instruction": "Welche Grundlagen können eine Verarbeitung personenbezogener Daten rechtmäßig machen?",
    "answerOptions": [
        "Einwilligung",
        "Erforderlichkeit zur Vertragserfüllung",
        "Erfüllung einer rechtlichen Verpflichtung",
        "Bloße technische Möglichkeit der Datenerhebung"
    ],
    "correct": [
        0,
        1,
        2
    ],
    "explainInstruction": "Art. 6 DSGVO nennt mehrere Rechtsgrundlagen. Die technische Möglichkeit allein erlaubt keine Verarbeitung."
}