{
  "inputMode": "SINGLE_CHOICE",
  "instruction": "Was bedeutet die Multiplizität `0..1` an einem Ende einer Beziehung?",
  "answerOptions": [
    "Es darf kein oder genau ein zugeordnetes Objekt geben",
    "Es muss mindestens ein Objekt geben",
    "Es müssen genau zwei Objekte existieren",
    "Es dürfen beliebig viele, aber nie null Objekte existieren"
  ],
  "correct": [0],
  "explainInstruction": "`0..1` beschreibt eine optionale Einzelzuordnung: kein oder höchstens ein Objekt.",
  "mobileSolvable": true,
  "learningLevel": 2,
  "difficulty": 1,
  "categories": [
    "AP1",
    "UML",
    "Klassendiagramm"
  ],
  "specializations": [
    "FIAN",
    "FISI",
    "FIDP",
    "FIDV"
  ]
}
